"Reversed left context";"Reversed center";"Left context";"Center";"Punct";"Right context";"Title";"Author";"Birthday";"Header";"Created";"Sphere";"Type";"Topic";"Publication";"Publ_year";"Medium";"Ambiguity";"Sentences";"Words";"Audience_age";"Audience_level";"Audience_size";"Full context";"Example source"
"";"ахиЛ";"";"Лиха";" ";"беда начало. ";"Б. Варецкий. Стыдные уроки барства. Власть и бедность // «Советская Россия», 2003.08.21";"Б. Варецкий";"";"Стыдные уроки барства. Власть и бедность";"2003";"публицистика";"статья";"политика и общественная жизнь";"«Советская Россия»";"2003.08.21";"газета";"омонимия снята вручную";"96";"1251";"н-возраст";"н-уровень";"большая";"Лиха беда начало. ";"701:61:0"
"";"ахиЛ";"";"Лиха";" ";"беда начало?  ";"Виктор Кульберг. Открывайтесь, сударь. Microsoft не уйдет с рынка, даже если придется опубликовать исходные коды // «Известия», 2002.07.30";"Виктор Кульберг";"";"Открывайтесь, сударь. Microsoft не уйдет с рынка, даже если придется опубликовать исходные коды";"2002";"публицистика";"статья";"наука и технологии";"«Известия»";"2002.07.30";"газета";"омонимия снята вручную";"38";"501";"н-возраст";"н-уровень";"большая";"Лиха беда начало?  ";"1181:35:0"
" ,ястировог каК";"ахил";"Как говорится, ";"лиха";" ";"беда начало. ";"Борис Екимов. Пиночет (1999)";"Борис Екимов";"1938";"Пиночет";"1999";"художественная";"повесть";"";"Борис Екимов. Пиночет";"2001";"книга";"омонимия снята вручную";"2991";"18474";"н-возраст";"н-уровень";"большая";"Как говорится, лиха беда начало. ";"899:1916:2"
" ― хяачулс хикат в тяровог каК";"ахил";"Как говорят в таких случаях ― ";"лиха";" ";"беда начало. ";"Ирина Архипова. Музыка жизни (1996)";"Ирина Архипова";"1925";"Музыка жизни";"1996";"публицистика";"мемуары";"";"Ирина Архипова. Музыка жизни";"1998";"книга";"омонимия снята вручную";"5510";"94921";"н-возраст";"н-уровень";"большая";"Как говорят в таких случаях ― лиха беда начало. ";"1549:4702:5"
"";"ахиЛ";"";"Лиха";" ";"беда начало.  ";"И. Грекова. Дамский мастер (1963)";"И. Грекова";"1907";"Дамский мастер";"1963";"художественная";"повесть";"";"На испытаниях";"1990";"книга";"омонимия снята вручную";"1832";"13316";"н-возраст";"н-уровень";"большая";"Лиха беда начало.  ";"841:1256:0"
"";"ахиЛ";"";"Лиха";" ";"беда начало. ";"И. Н. Вирабов. Андрей Вознесенский (2015)";"И. Н. Вирабов";"1959";"Андрей Вознесенский";"2015";"публицистика | нехудожественная";"монография";"искусство и культура | частная жизнь";"И. Н. Вирабов. Андрей Вознесенский";"2015";"книга";"омонимия не снята";"20293";"222730";"н-возраст";"н-уровень";"большая";"Лиха беда начало. ";"24609:2952:0"
" ,умонватсу-оп и ястичуан ,огечин( аволс еыпел";"ахил";"лепые слова (ничего, научится и по-уставному, ";"лиха";" ";"беда начало). ";"священник Сергий Круглов. На заброшенных гробницах (02.11.2015) // Православие и мир (pravmir.ru), 2015";"священник Сергий Круглов";"1966";"На заброшенных гробницах";"02.11.2015";"публицистика | нехудожественная";"статья";"политика и общественная жизнь | история | религия";"Православие и мир (pravmir.ru)";"2015";"электронный текст";"омонимия не снята";"32";"506";"н-возраст";"н-уровень";"большая";"Кто-то, препоясав джинсовые чресла взятым напрокат у входа в храм платком, уже сейчас, вот сейчас, держит в побелевших наманикюренных пальцах маленькую иконку Богородицы, шепчет в нее не совсем уставные, не совсем лепые слова (ничего, научится и по-уставному, лиха беда начало). ";"54137:30:37"
" ,ж отЧ";"ахил";"Что ж, ";"лиха";" ";"беда начало. ";"Майя Кучерская. Тетя Мотя // «Знамя», 2012";"Майя Кучерская";"1970";"Тетя Мотя";"2012";"художественная";"роман";"";"«Знамя»";"2012";"журнал";"омонимия не снята";"9170";"111973";"н-возраст";"н-уровень";"большая";"Что ж, лиха беда начало. ";"23201:1915:2"
" окандО";"ахил";"Однако ";"лиха";" ";"беда ― начало!  ";"Станислав Славин. Вести из лабораторий. Вперед на лазерном луче // Юный техник, 2012";"Станислав Славин";"";"Вести из лабораторий. Вперед на лазерном луче";"2012";"публицистика | нехудожественная";"статья";"наука и технологии";"Юный техник";"2012";"журнал";"омонимия не снята";"68";"894";"детский | подростковый";"н-уровень";"большая";"Однако лиха беда ― начало!  ";"40074:33:1"
"";"ахиЛ";"";"Лиха";" ";"беда ― начало!  ";"Форум: Семейное образование. Стандарты 2-го поколения (2011)";"коллективный";"";"Форум: Семейное образование. Стандарты 2-го поколения";"2011";"электронная коммуникация | нехудожественная";"форум";"образование";"";"2011";"электронный текст";"омонимия не снята";"291";"3568";"взрослый";"н-уровень";"большая";"[СветланаАм, жен] Лиха беда ― начало!  ";"25262:136:0"
" ад уН";"ахил";"Ну да ";"лиха";" ";"беда начало!  ";"Татьяна Соломатина. Девять месяцев, или «Комедия женских положений» (2010)";"Татьяна Соломатина";"1971";"Девять месяцев, или «Комедия женских положений»";"2010";"художественная";"повесть";"";"Татьяна Соломатина. Девять месяцев, или «Комедия женских положений»";"2010";"книга";"омонимия не снята";"7279";"84174";"н-возраст";"н-уровень";"большая";"Ну да лиха беда начало!  ";"24288:6108:2"
" ― ,имактеном екур йоварп оге в имищюавигырпдоп";"ахил";"подпрыгивающими в его правой руке монетками, ― ";"лиха";" ";"беда начало. ";"Ю. И. Андреева. Многоточие сборки (2009)";"Ю. И. Андреева";"1969";"Многоточие сборки";"2009";"художественная";"повесть";"";"Андреева Юлия. Многоточие сборки. СПб.: Лениздат, 2010";"2010";"книга";"омонимия не снята";"6381";"80130";"н-возраст";"н-уровень";"большая";"Ничего, Рыло, ― Король блаженно улыбался, жонглируя двумя весело подпрыгивающими в его правой руке монетками, ― лиха беда начало. ";"21820:5096:14"
" ,ястировог как ,он ,аляотсдерп окьлот еще";"ахил";"еще только предстояла, но, как говорится, ";"лиха";" ";"беда начало, принципиальное согласие Мокея было";"Николай Дежнев. Принцип неопределенности (2009)";"Николай Дежнев";"1946";"Принцип неопределенности";"2009";"художественная";"роман";"";"Дежнев Николай. Принцип неопределенности";"2009";"книга";"омонимия не снята";"7054";"90429";"н-возраст";"н-уровень";"большая";"Тут, правда, Шепетуха себе льстил, работа по лепке задуманного образа еще только предстояла, но, как говорится, лиха беда начало, принципиальное согласие Мокея было получено. ";"22512:5278:16"
"";"ахиЛ";"";"Лиха";" ";"беда начало!  ";"Олег Шереметьев. Эскадрон гусар летучих // «Родина», 2008";"Олег Шереметьев";"";"Эскадрон гусар летучих";"2008";"публицистика | нехудожественная";"статья";"история | армия и вооруженные конфликты | политика и общественная жизнь";"«Родина»";"2008";"журнал";"омонимия не снята";"142";"2659";"н-возраст";"высокий";"большая";"Лиха беда начало!  ";"39287:41:0"
" ьдев он ,олыб ен акоп етнорф";"ахил";"фронте пока не было, но ведь ";"лиха";" ";"беда начало… ";"А. Алексеев. Россия в 1914-1915 годах. Война на два фронта // «Наука и жизнь», 2007";"А. Алексеев";"";"Россия в 1914-1915 годах. Война на два фронта";"2007";"публицистика | нехудожественная";"статья";"наука и технологии | история";"«Наука и жизнь»";"2007";"журнал";"омонимия не снята";"550";"9370";"н-возраст";"н-уровень";"большая";"Убитых на внутреннем фронте пока не было, но ведь лиха беда начало… ";"37165:549:9"
" ― ёчин оН";"ахил";"Но ничё ― ";"лиха";" ";"беда начало… ";"В. Ю. Кунгурцева. Похождения Вани Житного, или Волшебный мел (2007)";"В. Ю. Кунгурцева";"1960";"Похождения Вани Житного, или Волшебный мел";"2007";"художественная";"повесть";"";"В. Ю. Кунгурцева, «Ведогони, или Новые похождения Вани Житного» Оги, Москва, 2009";"2009";"книга";"омонимия не снята";"9371";"96599";"н-возраст";"н-уровень";"большая";"Но ничё ― лиха беда начало… ";"23204:4807:2"
" ,иджодоп ;ытавогород акоп итэ ытараппА";"ахил";"Аппараты эти пока дороговаты; подожди, ";"лиха";" ";"беда начало. ";"Александр Архангельский. 1962: послание к Тимофею (2006)";"Александр Архангельский";"1962";"1962: послание к Тимофею";"2006";"публицистика | нехудожественная";"мемуары";"";"Архангельский А. 1962";"2006";"книга";"омонимия не снята";"3606";"42857";"н-возраст";"н-уровень";"большая";"Аппараты эти пока дороговаты; подожди, лиха беда начало. ";"22181:2242:5"
"";"ахиЛ";"";"Лиха";" ";"беда начало, ― пробормотал Лев Наумович. ";"Ирина Павская. «Джоконда» Мценского уезда (2006)";"Ирина Павская";"";"«Джоконда» Мценского уезда";"2006";"художественная";"роман";"";"И. С. Павская. «Джоконда» Мценского уезда";"2006";"книга";"омонимия не снята";"5474";"47419";"н-возраст";"н-уровень";"большая";"Лиха беда начало, ― пробормотал Лев Наумович. ";"22504:4643:0"
" ,ьдев  от А";"ахил";"А то  ведь, ";"лиха";" ";"беда начало. ";"В. Г. Галактионова. 5/4 накануне тишины // «Москва», № 11, 12. 2004";"В. Г. Галактионова";"1948";"5/4 накануне тишины";"2004";"художественная";"роман";"";"«Москва», № 11, 12. 2004";"2004";"журнал";"омонимия не снята";"16036";"116639";"н-возраст";"н-уровень";"большая";"А то  ведь, лиха беда начало. ";"22714:638:3"
" ― морад илапорп ен яилису еыннежолирп ,олед";"ахил";"дело, приложенные усилия не пропали даром ― ";"лиха";" ";"беда начало. ";"Геннадий Горелик. Андрей Сахаров. Наука и свобода (2004)";"Геннадий Горелик";"1945-1950";"Андрей Сахаров. Наука и свобода";"2004";"учебно-научная | нехудожественная";"монография";"наука и технологии | физика | политика и общественная жизнь";"Горелик Г. Андрей Сахаров. Наука и свобода";"2004";"книга";"омонимия не снята";"9444";"141613";"н-возраст";"н-уровень";"большая";"Хотя прибор и не пошел в дело, приложенные усилия не пропали даром ― лиха беда начало. ";"53956:1653:12"
" ,ястировог каК";"ахил";"Как говорится, ";"лиха";" ";"беда ― начало. ";"Борис Грищенко. Посторонний в Кремле (2004)";"Борис Грищенко";"1937";"Посторонний в Кремле";"2004";"публицистика | нехудожественная";"мемуары";"политика и общественная жизнь";"Борис Грищенко. Посторонний в Кремле";"2004";"книга";"омонимия не снята";"4134";"60994";"н-возраст";"н-уровень";"большая";"Как говорится, лиха беда ― начало. ";"53957:2705:2"
" ― ечани или кат ,мечорпВ";"ахил";"Впрочем, так или иначе ― ";"лиха";" ";"беда ― начало. ";"Евгений Козловский. Домашний Кинотеатр (2004) // «Бизнес-журнал», 13.02.2004";"Евгений Козловский";"";"Домашний Кинотеатр";"2004";"публицистика | нехудожественная";"статья";"техника";"«Бизнес-журнал»";"13.02.2004";"журнал";"омонимия не снята";"213";"4749";"н-возраст";"н-уровень";"большая";"Впрочем, так или иначе ― лиха беда ― начало. ";"8887:114:4"
" ,уН";"ахил";"Ну, ";"лиха";" ";"беда начало!.. ";"Женщина + мужчина: Брак (форум) (2004)";"коллективный";"";"Женщина + мужчина: Брак (форум)";"2004";"электронная коммуникация | нехудожественная";"форум";"частная жизнь";"Форум на eva.ru";"2005";"электронный текст";"омонимия не снята";"21451";"200934";"н-возраст";"н-уровень";"средняя";"[Руна] Ну, лиха беда начало!.. ";"25339:108:1"
"";"ахиЛ";"";"Лиха";" ";"беда начало. ";"Женщина + мужчина: Секс (форум) (2004)";"коллективный";"";"Женщина + мужчина: Секс (форум)";"2004";"электронная коммуникация | нехудожественная";"форум";"частная жизнь";"Форум на eva.ru";"2005";"электронный текст";"омонимия не снята";"15407";"112265";"н-возраст";"н-уровень";"средняя";"[Бодибилдер] Лиха беда начало. ";"25337:4972:0"
" он ,волескип 042x023 или";"ахил";"или 320x240 пикселов, но ";"лиха";" ";"беда начало… ";"Добрались до зажигалок (2004) // «Homes & Gardens», 01.12.2004";"неизвестный";"";"Добрались до зажигалок";"2004";"реклама | нехудожественная";"объявление";"техника";"«Homes & Gardens»";"01.12.2004";"журнал";"омонимия не снята";"8";"89";"н-возраст";"н-уровень";"большая";"Конечно, снимки получаются весьма посредственного качества ― ведь разрешение матрицы всего 640x480 или 320x240 пикселов, но лиха беда начало… ";"10989:4:17"
" ,ястировог как ,он ,ымелборп йонщилиж юинешер";"ахил";"решению жилищной проблемы, но, как говорится, ";"лиха";" ";"беда начало. ";"Легко ли быть молодым? (2004) // «Профессионал», 29.09.2004";"неизвестный";"";"Легко ли быть молодым?";"2004";"публицистика | нехудожественная";"интервью";"политика и общественная жизнь";"«Профессионал»";"29.09.2004";"журнал";"омонимия не снята";"75";"1334";"н-возраст";"н-уровень";"средняя";"Конечно, все это только первые шаги к решению жилищной проблемы, но, как говорится, лиха беда начало. ";"13678:49:13"
"«  :ебес лировог ,илсым еынжоверт ляногто Я";"ахиЛ";"Я отгонял тревожные мысли, говорил себе:  «";"Лиха";" ";"беда ― начало», ― и в то же";"Вальтер Запашный. Риск. Борьба. Любовь (1998-2004)";"Вальтер Запашный";"1928";"Риск. Борьба. Любовь";"1998-2004";"публицистика | нехудожественная";"мемуары";"";"Вальтер Запашный. Риск. Борьба. Любовь";"2004";"книга";"омонимия не снята";"8103";"74708";"н-возраст";"н-уровень";"большая";"Я отгонял тревожные мысли, говорил себе:  «Лиха беда ― начало», ― и в то же время потерял сон и аппетит, меня лихорадило, бросало в пот, пересыхало во рту… ";"24680:1439:6"
"";"ахиЛ";"";"Лиха";" ";"беда ― начало, ― ответил Асанов, озираясь на";"Вальтер Запашный. Риск. Борьба. Любовь (1998-2004)";"Вальтер Запашный";"1928";"Риск. Борьба. Любовь";"1998-2004";"публицистика | нехудожественная";"мемуары";"";"Вальтер Запашный. Риск. Борьба. Любовь";"2004";"книга";"омонимия не снята";"8103";"74708";"н-возраст";"н-уровень";"большая";"Лиха беда ― начало, ― ответил Асанов, озираясь на многочисленные клетки, где размещались уже шесть тигров, не считая животных других пород. ";"24680:1712:0"
" ,ястеавызан отЧ";"ахил";"Что называется, ";"лиха";" ";"беда начало. ";"Юлий Андреев. Знание и ум (2003) // Интернет-альманах «Лебедь», 28.09.2003";"Юлий Андреев";"";"Знание и ум";"2003";"публицистика | нехудожественная";"статья";"политика и общественная жизнь";"Интернет-альманах «Лебедь»";"28.09.2003";"электронное издание";"омонимия не снята";"191";"3184";"н-возраст";"н-уровень";"средняя";"Что называется, лиха беда начало. ";"2483:19:2"
" ,ястировог как ,он ,ытянс модус илыб";"ахил";"были судом сняты, но, как говорится, ";"лиха";" ";"беда начало. ";"Марк Дейч. Зеленый терроризм (2003) // «Московский комсомолец», 15.01.2003";"Марк Дейч";"";"Зеленый терроризм";"2003";"публицистика | нехудожественная";"статья";"политика и общественная жизнь";"«Московский комсомолец»";"15.01.2003";"газета";"омонимия не снята";"226";"2951";"н-возраст";"н-уровень";"большая";"Обвинения с писателя были судом сняты, но, как говорится, лиха беда начало. ";"17308:67:9"
"";"ахиЛ";"";"Лиха";" ";"беда начало. ";"Андрей Тральников. Нет «лишнего» рыбьего хвоста (2003) // «Рыбак Приморья», 16.01.2003";"Андрей Тральников";"";"Нет «лишнего» рыбьего хвоста";"2003";"публицистика | нехудожественная";"заметка";"производство";"«Рыбак Приморья»";"16.01.2003";"газета";"омонимия не снята";"13";"188";"н-возраст";"н-уровень";"средняя";"Лиха беда начало. ";"4287:5:0"
" ,мечорпВ";"ахил";"Впрочем, ";"лиха";" ";"беда начало; в конце концов когда-нибудь";"Александр Архангельский. ...или политика занимается тобой. Рынок прогрессирует быстрей, чем развивается самосознание общества (2002) // «Известия», 25.11.2002";"Александр Архангельский";"1962";"...или политика занимается тобой. Рынок прогрессирует быстрей, чем развивается самосознание общества";"2002";"публицистика | нехудожественная";"статья";"политика и общественная жизнь";"«Известия»";"25.11.2002";"газета";"омонимия не снята";"38";"555";"н-возраст";"н-уровень";"большая";"Впрочем, лиха беда начало; в конце концов когда-нибудь до большинства наших соотечественников дойдет простая формула «или ты занимаешься политикой, или политика ― тобой». ";"28528:36:1"
" оН";"ахил";"Но ";"лиха";" ";"беда начало. ";"Анатолий Грешневиков. Зов Арктики (2002) // «Наш современник», 15.08.2002";"Анатолий Грешневиков";"";"Зов Арктики";"2002";"публицистика | нехудожественная";"статья";"природа";"«Наш современник»";"15.08.2002";"журнал";"омонимия не снята";"513";"9114";"н-возраст";"н-уровень";"большая";"Но лиха беда начало. ";"13291:424:1"
