"Reversed left context";"Reversed center";"Left context";"Center";"Punct";"Right context";"Title";"Author";"Birthday";"Header";"Created";"Sphere";"Type";"Topic";"Publication";"Publ_year";"Medium";"Ambiguity";"Sentences";"Words";"Audience_age";"Audience_level";"Audience_size";"Full context";"Example source"
" оН";"ахил";"Но ";"лиха";" ";"беда начало. ";"Выставки, выставки, выставки... (2002) // «Биржа плюс свой дом» (Н. Новгород), 16.12.2002";"неизвестный";"";"Выставки, выставки, выставки...";"2002";"публицистика | нехудожественная";"заметка";"дом и домашнее хозяйство";"«Биржа плюс свой дом» (Н. Новгород)";"16.12.2002";"газета";"омонимия не снята";"52";"389";"н-возраст";"н-уровень";"средняя";"Но лиха беда начало. ";"959:4:1"
" :юьлсым йондо ьшил ьтишету ябес онжоМ";"ахил";"Можно себя утешить лишь одной мыслью: ";"лиха";" ";"беда начало. ";"Неподнятая целина (2002) // «Аграрный журнал», 15.02.2002";"неизвестный";"";"Неподнятая целина";"2002";"учебно-научная | нехудожественная";"статья";"сельское хозяйство";"«Аграрный журнал»";"15.02.2002";"журнал";"омонимия не снята";"99";"1282";"н-возраст";"н-уровень";"средняя";"Можно себя утешить лишь одной мыслью: лиха беда начало. ";"8335:20:6"
" ,ыб ьсолазаК";"ахил";"Казалось бы, ";"лиха";" ";"беда начало: и страховщики, и милиционеры";"Новости (2002) // «Автопилот», 15.11.2002";"неизвестный";"";"Новости";"2002";"публицистика | нехудожественная";"заметка";"транспорт";"«Автопилот»";"15.11.2002";"журнал";"омонимия не снята";"204";"3158";"н-возраст";"н-уровень";"большая";"Казалось бы, лиха беда начало: и страховщики, и милиционеры начали, пускай и отдельно друг от друга, бороться с очевидным злом. ";"30995:16:2"
" он ,еынчонидо илыб ылертсыв итсач йешьлоб";"ахил";"большей части выстрелы были одиночные, но ";"лиха";" ";"беда начало. ";"Владимир Шаров. Воскрешение Лазаря (1997-2002)";"Владимир Шаров";"1952";"Воскрешение Лазаря";"1997-2002";"художественная";"роман";"";"Владимир Шаров. Воскрешение Лазаря";"2002";"книга";"омонимия не снята";"6182";"115499";"н-возраст";"н-уровень";"большая";"По большей части выстрелы были одиночные, но лиха беда начало. ";"53333:4640:7"
"";"ахиЛ";"";"Лиха";" ";"беда начало: во второй раз он";"Ирина Безладнова. Такая женщина // «Звезда», 2001";"Ирина Безладнова";"";"Такая женщина";"2001";"художественная";"повесть";"";"«Звезда»";"2001";"журнал";"омонимия не снята";"1454";"19607";"н-возраст";"н-уровень";"большая";"Лиха беда начало: во второй раз он напился, потому что его матери перестали регулярно выплачивать пенсию, а он не мог помочь. ";"62288:1099:0"
"";"ахиЛ";"";"Лиха";" ";"беда начало: есть дыра, будет и";"М. Л. Гаспаров. Записи и выписки (2001)";"М. Л. Гаспаров";"1935";"Записи и выписки";"2001";"публицистика | нехудожественная";"эссе";"искусство и культура";"М. Л. Гаспаров. Записи и выписки";"2001";"книга";"омонимия не снята";"10050";"139509";"н-возраст";"высокий";"средняя";"Лиха беда начало: есть дыра, будет и прореха». ";"42124:4348:0"
" ,ястировог как ,он ,огонмен вотнаираВ";"ахил";"Вариантов немного, но, как говорится, ";"лиха";" ";"беда начало. ";"Владимир Ермаков. Ключ ко всем дверям (2001) // «Европа», 15.06.2001";"Владимир Ермаков";"";"Ключ ко всем дверям";"2001";"публицистика | нехудожественная";"статья";"наука и технологии";"«Европа»";"15.06.2001";"журнал";"омонимия не снята";"58";"801";"н-возраст";"н-уровень";"средняя";"Вариантов немного, но, как говорится, лиха беда начало. ";"9756:56:5"
" он ,езатскэ моньлауткеллетни в ястюьлос ино";"ахил";"они сольются в интеллектуальном экстазе, но ";"лиха";" ";"беда начало… ";"Юрий Поляков. Пролегомены к согласию (2001)";"Юрий Поляков";"1954";"Пролегомены к согласию";"2001";"публицистика | нехудожественная";"предисловие, послесловие";"политика и общественная жизнь";"Десять лет которые потрясли";"2001";"книга";"омонимия не снята";"31";"473";"н-возраст";"н-уровень";"средняя";"Это совсем не означает, что завтра они сольются в интеллектуальном экстазе, но лиха беда начало… ";"53845:22:12"
" ьдев он ,вортил атсирт ен ,онченок";"ахил";"конечно, не триста литров, но ведь ";"лиха";" ";"беда начало. ";"Геннадий Прашкевич, Александр Богдан. Человек «Ч» (2001)";"Геннадий Прашкевич | Александр Богдан";"";"Человек «Ч»";"2001";"художественная";"роман";"";"«Геннадий Прашкевич, Александр Богдан. Человек «Ч»";"2001";"книга";"омонимия не снята";"9338";"79436";"н-возраст";"н-уровень";"большая";"Три литра ― это, конечно, не триста литров, но ведь лиха беда начало. ";"52881:6956:9"
" ,ястировог как ,он ,туним ьтясед теашыверп";"ахил";"превышает десять минут, но, как говорится, ";"лиха";" ";"беда начало. ";"Людмила Самборская. Как вырастить Золушку (2001) // «Европа», 15.06.2001";"Людмила Самборская";"";"Как вырастить Золушку";"2001";"публицистика | нехудожественная";"статья";"политика и общественная жизнь";"«Европа»";"15.06.2001";"журнал";"омонимия не снята";"76";"1329";"н-возраст";"н-уровень";"средняя";"Продолжительность таких «работ» едва ли превышает десять минут, но, как говорится, лиха беда начало. ";"9760:24:11"
"";"ахиЛ";"";"Лиха";" ";"беда ― начало… ";"Виктор Слипенчук. Зинзивер (2001)";"Виктор Слипенчук";"1941";"Зинзивер";"2001";"художественная";"роман";"";"Виктор Слипенчук. Зинзивер";"2001";"книга";"омонимия не снята";"7569";"102245";"н-возраст";"н-уровень";"большая";"Лиха беда ― начало… ";"53354:2740:0"
"";"ахиЛ";"";"Лиха";" ";"беда начало. ";"Геннадий Трошев. Моя война (2000-2001)";"Геннадий Трошев";"1947";"Моя война";"2000-2001";"публицистика | нехудожественная";"мемуары";"";"Геннадий Трошев. Моя война";"2001";"книга";"омонимия не снята";"6651";"81610";"н-возраст";"н-уровень";"большая";"Лиха беда начало. ";"53804:35:0"
" ,мещбо В";"ахил";"В общем, ";"лиха";" ";"беда ― начало. ";"Геннадий Трошев. Моя война (2000-2001)";"Геннадий Трошев";"1947";"Моя война";"2000-2001";"публицистика | нехудожественная";"мемуары";"";"Геннадий Трошев. Моя война";"2001";"книга";"омонимия не снята";"6651";"81610";"н-возраст";"н-уровень";"большая";"В общем, лиха беда ― начало. ";"53804:187:2"
" оН";"ахил";"Но ";"лиха";" ";"беда начало. ";"Александр Архангельский. Александр I (2000)";"Александр Архангельский";"1962";"Александр I";"2000";"публицистика | нехудожественная";"монография";"наука и технологии | история";"Александр Архангельский «Александр I»";"2000";"книга";"омонимия не снята";"9086";"134041";"н-возраст";"н-уровень";"большая";"Но лиха беда начало. ";"53849:6174:1"
" ,огечиН";"ахил";"Ничего, ";"лиха";" ";"беда начало, аппетит приходит во время";"Марианна Баконина. Школа двойников (2000)";"Марианна Баконина";"1964";"Школа двойников";"2000";"художественная";"роман";"";"Марианна Баконина.Школа двойников";"2000";"книга";"омонимия не снята";"9382";"90091";"н-возраст";"н-уровень";"большая";"Ничего, лиха беда начало, аппетит приходит во время еды, а мускулы лица тянутся легко и быстро. ";"52858:2227:1"
" оН";"ахил";"Но ";"лиха";" ";"беда начало: калькуляторы уменьшались в размерах";"Владислав Быков, Ольга Деркач. Книга века (2000)";"Владислав Быков | Ольга Деркач";"";"Книга века";"2000";"публицистика | нехудожественная";"монография";"политика и общественная жизнь";"Быков В., Деркач В. В. Книга века";"2001";"книга";"омонимия не снята";"16796";"197611";"н-возраст";"н-уровень";"большая";"Но лиха беда начало: калькуляторы уменьшались в размерах, дешевели на глазах и стремительно входили в жизнь каждого, кто хоть каким-то боком был связан с арифметикой. ";"35984:11677:1"
" ,ж отч уН";"ахил";"Ну что ж, ";"лиха";" ";"беда начало! ― Комар удовлетворенно потер руки. ";"Лев Дворецкий. Шакалы (2000)";"Лев Дворецкий";"1927";"Шакалы";"2000";"художественная";"роман";"";"Лев Дворецкий. Шакалы";"2000";"книга";"омонимия не снята";"10450";"84707";"н-возраст";"н-уровень";"большая";"Ну что ж, лиха беда начало! ― Комар удовлетворенно потер руки. ";"52864:5264:3"
" оН";"ахил";"Но ";"лиха";" ";"беда начало. ";"Евгений Рубин. Пан или пропал. Жизнеописание (1999-2000)";"Евгений Рубин";"1947";"Пан или пропал. Жизнеописание";"1999-2000";"публицистика | нехудожественная";"мемуары";"";"Евгений Рубин. Пан или пропал. Жизнеописание";"2000";"книга";"омонимия не снята";"10791";"140999";"н-возраст";"н-уровень";"большая";"Но лиха беда начало. ";"59975:10052:1"
"«  :лазакС";"ахиЛ";"Сказал:  «";"Лиха";" ";"беда начало». ";"Муслим Магомаев. Любовь моя ― мелодия (1999)";"Муслим Магомаев";"1942";"Любовь моя ― мелодия";"1999";"публицистика | нехудожественная";"мемуары";"";"Муслим Магомаев. Любовь моя ― мелодия";"1999";"книга";"омонимия не снята";"7102";"78641";"н-возраст";"н-уровень";"большая";"Сказал:  «Лиха беда начало». ";"52900:4098:1"
"";"ахиЛ";"";"Лиха";" ";"беда начало. ";"Юрий Сенкевич. Путешествие длиною в жизнь (1999)";"Юрий Сенкевич";"1937";"Путешествие длиною в жизнь";"1999";"публицистика | нехудожественная";"мемуары";"";"Юрий Сенкевич. Путешествие длиною в жизнь";"1999";"книга";"омонимия не снята";"7918";"98184";"н-возраст";"н-уровень";"большая";"Лиха беда начало. ";"52918:5793:0"
" оН";"ахил";"Но ";"лиха";" ";"беда ― начало. ";"Б. Е. Черток. Ракеты и люди (1999)";"Б. Е. Черток";"1912";"Ракеты и люди";"1999";"публицистика | нехудожественная";"мемуары";"техника | история";"Б. Е. Черток. Ракеты и люди";"1999";"книга";"омонимия не снята";"34730";"476976";"н-возраст";"н-уровень";"большая";"Но лиха беда ― начало. ";"22348:1938:1"
" он ,аногав огонжородонзележ то ьлибомотва йовозург";"ахил";"грузовой автомобиль от железнодорожного вагона, но ";"лиха";" ";"беда начало. ";"Б. Е. Черток. Ракеты и люди (1999)";"Б. Е. Черток";"1912";"Ракеты и люди";"1999";"публицистика | нехудожественная";"мемуары";"техника | история";"Б. Е. Черток. Ракеты и люди";"1999";"книга";"омонимия не снята";"34730";"476976";"н-возраст";"н-уровень";"большая";"Еще трудно было отличить грузовой автомобиль от железнодорожного вагона, но лиха беда начало. ";"22348:11867:10"
"";"ахиЛ";"";"Лиха";" ";"беда начало!  ";"Татьяна Окуневская. Татьянин день (1998)";"Татьяна Окуневская";"1914";"Татьянин день";"1998";"публицистика | нехудожественная";"мемуары";"";"Татьяна Окуневская. Татьянин день";"1998";"книга";"омонимия не снята";"10002";"140511";"н-возраст";"н-уровень";"большая";"Лиха беда начало!  ";"52915:9375:0"
" ,йовреп с оге ливардзоп я киньлотс";"ахил";"стольник я поздравил его с первой, ";"лиха";" ";"беда начало, публикацией на бывшей родине";"Михаил Веллер. Ножик Сережи Довлатова (1997)";"Михаил Веллер";"1948";"Ножик Сережи Довлатова";"1997";"художественная";"роман";"";"Михаил Веллер. А вот те шиш!";"1997";"книга";"омонимия не снята";"1534";"16242";"взрослый";"н-уровень";"большая";"И рассказы благополучно вышли, и еще на телефонный стольник я поздравил его с первой, лиха беда начало, публикацией на бывшей родине, и отправил пяток экземпляров, приложив к ним из тщеславия, узаконенного профессиональной этикой, собственную книжку, снабдив ее надписью, составленной из всяких хороших слов, насчет читателя-почитателя и младшего последователя по эстонскому маршруту. ";"53373:857:14"
" оН";"ахил";"Но ";"лиха";" ";"беда начало. ";"Л. А. Левицкий. Дневник (1997)";"Л. А. Левицкий";"1929";"Дневник";"1997";"бытовая | нехудожественная";"дневник, записные книжки";"частная жизнь | искусство и культура | политика и общественная жизнь";"Левицкий Л. А. Термос времени. Дневник, 1978-1997. СПб.: Изд-во Сергея Ходова, 2006.";"2006";"книга";"омонимия не снята";"4920";"64412";"н-возраст";"н-уровень";"личная";"Но лиха беда начало. ";"20761:674:1"
" ― линмоп ниролФ";"ахил";"Флорин помнил ― ";"лиха";" ";"беда начало, а потом уж стерпится. ";"Дарья Симонова. Summary (1997)";"Дарья Симонова";"1972";"Summary";"1997";"художественная";"рассказ";"";"Дарья Симонова. Половецкие пляски";"2002";"книга";"омонимия не снята";"151";"1628";"н-возраст";"н-уровень";"большая";"Флорин помнил ― лиха беда начало, а потом уж стерпится. ";"24238:129:2"
" оН";"ахил";"Но ";"лиха";" ";"беда начало. ";"Л. А. Левицкий. Дневник (1996)";"Л. А. Левицкий";"1929";"Дневник";"1996";"бытовая | нехудожественная";"дневник, записные книжки";"частная жизнь | искусство и культура | политика и общественная жизнь";"Левицкий Л. А. Термос времени. Дневник, 1978-1997. СПб.: Изд-во Сергея Ходова, 2006.";"2006";"книга";"омонимия не снята";"2456";"36138";"н-возраст";"н-уровень";"личная";"Но лиха беда начало. ";"20760:346:1"
" ,огечиН";"ахил";"Ничего, ";"лиха";" ";"беда ― начало!  ";"Константин Серафимов. Экспедиция во мрак (1978-1996)";"Константин Серафимов";"1953";"Экспедиция во мрак";"1978-1996";"публицистика | нехудожественная";"монография";"спорт";"";"1994";"книга";"омонимия не снята";"16334";"167293";"н-возраст";"н-уровень";"средняя";"Ничего, лиха беда ― начало!  ";"35977:3022:1"
"";"ахиЛ";"";"Лиха";" ";"беда ― начало!  ";"Константин Серафимов. Экспедиция во мрак (1978-1996)";"Константин Серафимов";"1953";"Экспедиция во мрак";"1978-1996";"публицистика | нехудожественная";"монография";"спорт";"";"1994";"книга";"омонимия не снята";"16334";"167293";"н-возраст";"н-уровень";"средняя";"Лиха беда ― начало!  ";"35977:5534:0"
" ,ястировог как ,оН";"ахил";"Но, как говорится, ";"лиха";" ";"беда начало. ";"Александра Маринина. За все надо платить (1995)";"Александра Маринина";"1957";"За все надо платить";"1995";"художественная";"роман";"";"Александра Маринина. За все надо платить";"2006";"книга";"омонимия не снята";"11112";"116867";"н-возраст";"н-уровень";"большая";"Но, как говорится, лиха беда начало. ";"23304:787:3"
" ― огечин ,алитсуп ен ешьлад он ,екичнавид";"ахил";"диванчике, но дальше не пустила, ничего ― ";"лиха";" ";"беда начало. ";"Петр Алешковский. Жизнеописание Хорька (1990-1993)";"Петр Алешковский";"1957";"Жизнеописание Хорька";"1990-1993";"художественная";"повесть";"";"Алешковский П. Седьмой чемоданчик";"1999";"книга";"омонимия не снята";"2543";"41189";"н-возраст";"н-уровень";"большая";"Попер без боязни, целовались на диванчике, но дальше не пустила, ничего ― лиха беда начало. ";"53412:1002:11"
"";"ахиЛ";"";"Лиха";" ";"беда начало. ";"Михаил Зараев. Как возродить кулака // «Огонек». № 3, 1991";"Михаил Зараев";"";"Как возродить кулака";"1991";"публицистика | нехудожественная";"статья";"сельское хозяйство";"«Огонек». № 3";"1991";"журнал";"омонимия не снята";"464";"5329";"н-возраст";"н-уровень";"очень большая";"Лиха беда начало. ";"47451:454:0"
" ― мат а ,етид еовреп ьсоливяоп корс";"ахил";"срок появилось первое дите, а там ― ";"лиха";" ";"беда начало ― мать родила 13 детей";"Л. М. Каганович. Памятные записки (1991)";"Л. М. Каганович";"1893";"Памятные записки";"1991";"публицистика | нехудожественная";"мемуары";"";"Лазарь Каганович. Памятные записки";"1997";"книга";"омонимия не снята";"8572";"182757";"н-возраст";"н-уровень";"большая";"В положенный срок появилось первое дите, а там ― лиха беда начало ― мать родила 13 детей, из которых семь померли, а в живых осталось шесть ― пять сыновей и одна дочь. ";"53581:193:8"
" мат а ,ьсолачан оготэ С";"ахил";"С этого началось, а там ";"лиха";" ";"беда начало. ";"Л. М. Каганович. Памятные записки (1991)";"Л. М. Каганович";"1893";"Памятные записки";"1991";"публицистика | нехудожественная";"мемуары";"";"Лазарь Каганович. Памятные записки";"1997";"книга";"омонимия не снята";"8572";"182757";"н-возраст";"н-уровень";"большая";"С этого началось, а там лиха беда начало. ";"53581:1718:5"
"";"ахиЛ";"";"Лиха";" ";"беда начало… ";"Инна Семенова. Мрачные своды милосердия // «Пульс», 1990";"Инна Семенова";"";"Мрачные своды милосердия";"1990";"публицистика | нехудожественная";"очерк";"здоровье и медицина";"«Пульс»";"1990";"журнал";"омонимия не снята";"194";"1926";"молодежный";"н-уровень";"большая";"Лиха беда начало… ";"47948:78:0"
" оН";"ахил";"Но ";"лиха";" ";"беда начало. ";"Е. Михайловская. Дом окнами в сад // «Работница», 1989";"Е. Михайловская";"";"Дом окнами в сад";"1989";"публицистика | нехудожественная";"очерк";"политика и общественная жизнь";"«Работница»";"1989";"журнал";"омонимия не снята";"134";"1401";"н-возраст";"н-уровень";"большая";"Но лиха беда начало. ";"33737:44:1"
