"Reversed left context";"Reversed center";"Left context";"Center";"Punct";"Right context";"Title";"Author";"Birthday";"Header";"Created";"Sphere";"Type";"Topic";"Publication";"Publ_year";"Medium";"Ambiguity";"Sentences";"Words";"Audience_age";"Audience_level";"Audience_size";"Full context";"Example source"
"";"ахиЛ";"";"Лиха";" ";"беда начало. ";"И. Г. Гольдберг. День разгорается (1935)";"И. Г. Гольдберг";"1884";"День разгорается";"1935";"художественная";"роман";"";"Гольдберг И. День разгорается, Иркутск: ОГИЗ: Крайгиз, 1935";"1935";"книга";"омонимия не снята";"14849";"125033";"н-возраст";"н-уровень";"большая";"Лиха беда начало. ";"129492:8107:0"
" оН";"ахил";"Но ";"лиха";" ";"беда начало. ";"Н. Ф. Новиков. Дневник (1935)";"Н. Ф. Новиков";"1903";"Дневник";"1935";"бытовая | нехудожественная";"дневник, записные книжки";"частная жизнь | политика и общественная жизнь";"";"";"электронное издание";"омонимия не снята";"416";"4305";"н-возраст";"н-уровень";"личная";"Но лиха беда начало. ";"74556:319:1"
" ― оН";"ахил";"Но ― ";"лиха";" ";"беда начало. ";"Предисловие к книге «Страна счастливых» (1931)";"";"";"Предисловие к книге «Страна счастливых»";"1931";"публицистика | нехудожественная";"предисловие, послесловие";"политика и общественная жизнь";"Ларри Я. Страна счастливых";"1931";"книга";"омонимия не снята";"200";"3486";"н-возраст";"н-уровень";"большая";"Но ― лиха беда начало. ";"76866:178:1"
"«  :укровогоп юукссур линмопсв Я";"ахиЛ";"Я вспомнил русскую поговорку:  «";"Лиха";" ";"беда ― начало», проникся гордым сознанием, что";"М. С. Бабушкин. На зверобойных промыслах (1926-1931)";"М. С. Бабушкин";"1893";"На зверобойных промыслах";"1926-1931";"публицистика | нехудожественная";"мемуары";"политика и общественная жизнь | техника";"Записки летчика М. С. Бабушкина. 1893-1938";"1941";"книга";"омонимия не снята";"519";"5560";"н-возраст";"н-уровень";"большая";"Я вспомнил русскую поговорку:  «Лиха беда ― начало», проникся гордым сознанием, что являюсь пионером этого дела, и стал расспрашивать Еремеева о «зверобойке». ";"72723:41:4"
"";"ахиЛ";"";"Лиха";" ";"беда начало… ";"П. А. Богданов. Дневники (1925)";"П. А. Богданов";"1888";"Дневники";"1925";"бытовая";"дневник, записные книжки";"частная жизнь | политика и общественная жизнь | сельское хозяйство";"";"";"электронный текст";"омонимия не снята";"1966";"17953";"н-возраст";"н-уровень";"личная";"Лиха беда начало… ";"74137:1662:0"
"";"ахиЛ";"";"Лиха";" ";"беда начало: будут поступать и эти";"П. К. Козлов. Географический дневник Тибетской экспедиции 1923-1926 гг. №2 (1924)";"П. К. Козлов";"1863";"Географический дневник Тибетской экспедиции 1923-1926 гг. №2";"1924";"учебно-научная | нехудожественная";"дневник, записные книжки";"наука и технологии | география";"П. К. Козлов. Дневники монголо-тибетской экспедиции. 1923-1926. (Научное наследство. Т. 30)";"2003";"книга";"омонимия не снята";"5794";"88292";"н-возраст";"н-уровень";"средняя";"Лиха беда начало: будут поступать и эти зверьки, как было с первыми змеями ― сначала ни одной, а потом ― избыток; пришлось их убивать, ведь мы взяли в коллекцию всего около шести экземпляров. ";"77435:1428:0"
"";"ахиЛ";"";"Лиха";" ";"беда начало. ";"М. М. Пришвин. Дневники (1921)";"М. М. Пришвин";"1873";"Дневники";"1921";"публицистика | нехудожественная";"дневник, записные книжки";"";"М. М. Пришвин. Дневники. 1920-1922. ― М.: Московский рабочий, 1995";"1995";"книга";"омонимия не снята";"2977";"36633";"н-возраст";"н-уровень";"большая";"Лиха беда начало. ";"127277:2418:0"
"« тировог ациволсоп яакссур он ,олам акоп";"ахил";"пока мало, но русская пословица говорит «";"лиха";" ";"беда ― начало» и руководители надеются, что";"В отделах Всевобуч // «Русский спорт», 1919";"коллективный";"";"В отделах Всевобуч";"1919";"публицистика | нехудожественная";"заметка";"образование | спорт";"«Русский спорт»";"1919";"журнал";"омонимия не снята";"136";"2491";"н-возраст";"н-уровень";"средняя";"В члены общества записалось, что очень отрадно видеть несколько женщин; их, правда, пока мало, но русская пословица говорит «лиха беда ― начало» и руководители надеются, что к середине лета они будут видеть членами о-ва 30 или 40 женщин. ";"81970:84:18"
"";"ахиЛ";"";"Лиха";" ";"беда начало!  ";"С. Т. Семенов. Беженка Луиза (1916)";"С. Т. Семенов";"1868";"Беженка Луиза";"1916";"художественная";"рассказ";"";"Семенов С. Т. Рассказы и повести";"1983";"книга";"омонимия не снята";"934";"7842";"н-возраст";"н-уровень";"большая";"Лиха беда начало!  ";"127787:660:0"
"";"ахиЛ";"";"Лиха";" ";"беда начало, а то, може, за";"С. Т. Семенов. Гаврила Скворцов (1904)";"С. Т. Семенов";"1868";"Гаврила Скворцов";"1904";"художественная";"повесть";"";"Семенов С. Т. Рассказы и повести";"1983";"книга";"омонимия не снята";"2188";"23268";"н-возраст";"н-уровень";"большая";"Лиха беда начало, а то, може, за одним-то другой да третий. ";"127802:393:0"
" еьнарв оВ";"ахил";"Во вранье ";"лиха";" ";"беда начало, а там до того";"А. В. Амфитеатров. Княжна (1889-1895)";"А. В. Амфитеатров";"1862";"Княжна";"1889-1895";"художественная";"роман";"";"А. В. Амфитеатров. Собрание сочинений в 10 томах. Т. 1";"2000";"книга";"омонимия не снята";"6311";"68808";"н-возраст";"н-уровень";"большая";"Во вранье лиха беда начало, а там до того доврешься, что и сам себе верить начнешь… ";"62751:4028:2"
" ,ьтачан ьдубин-огеч с еж одан оН";"ахил";"Но надо же с чего-нибудь начать, ";"лиха";" ";"беда начало, а потом, я думаю";"Г. И. Успенский. Письма (1887)";"Г. И. Успенский";"1843";"Письма";"1887";"бытовая | нехудожественная";"письмо";"частная жизнь";"Успенский Г. И. Собрание сочинений в девяти томах. Том девятый. Статьи. Письма";"1957";"книга";"омонимия не снята";"2895";"34403";"н-возраст";"н-уровень";"большая";"Но надо же с чего-нибудь начать, лиха беда начало, а потом, я думаю, будет и лучше. ";"69049:1504:6"
" ― хи юавытабаререп окьлот я ― вотог жу";"ахил";"уж готов ― я только перерабатываю их ― ";"лиха";" ";"беда начало, а тема будет разраб[";"Г. И. Успенский. Письма (1887)";"Г. И. Успенский";"1843";"Письма";"1887";"бытовая | нехудожественная";"письмо";"частная жизнь";"Успенский Г. И. Собрание сочинений в девяти томах. Том девятый. Статьи. Письма";"1957";"книга";"омонимия не снята";"2895";"34403";"н-возраст";"н-уровень";"большая";"Не только этот первый, но и второй очерк у меня уж готов ― я только перерабатываю их ― лиха беда начало, а тема будет разраб[отана] до января. ";"69049:2152:16"
